{
  "item_id": "idiom-the-devil-is-in-the-details",
  "status": "new",
  "last_reviewed": null,
  "next_due": "2026-03-25",
  "correct_count": 0,
  "partial_count": 0,
  "incorrect_count": 0,
  "lapse_count": 0,
  "ease": 2.5,
  "stability": 0,
  "recall_dimensions": {
    "definition": 0,
    "sentence_usage": 0,
    "root_understanding": 0
  },
  "notes": []
}
